Job Title,Company,Location,Category
SALES EXECUTIVE,Gurkha Watch and Accessories,Kathmandu,Sales
Program Lead,Global Green Growth Institute- Nepal Program,Kathmandu,"Engineering - Environment, Development and Project"
EOI आह्वान,Rural Women Upliftment Association (RWUA),Sarlahi,"Expression of Interests, Tender Notice, Bid"
Nutrition Field Officer,Integrated Rural Development Society,Mahottari,"Public Health, Development and Project"
Software ﻿QA Engineer Testing,CodeBee Nepal Pvt. Ltd.(Sister Concern Of WallBee APS),Kathmandu,"Engineering - Software, Software Development"
Software Developer Dot Net,CodeBee Nepal Pvt. Ltd.(Sister Concern Of WallBee APS),Kathmandu,"Engineering - Software, Software Development"
"Interpreter, Translator, Bridge Engineer, Highway Engineer, HSE, Civil Engineer, Office Staff",Poly Changda Engineering Company,Terai Region,"Engineering - Civil, Engineering - Structural, Office Assistant"
Expression of Interest to Conduct Training of Trainers (TOT),Access Planet Organization,Rupandehi,"Development and Project, Expression of Interests, Tender Notice, Bid"
Admin Associate,Bagmati Welfare Society Nepal(BWSN),Sarlahi,"Administrative / Management, Development and Project"
बाख्रा आपुर्ति सम्बन्धि टेण्डर आह्वान गरिएको सूचना,CEAD Nepal Doti,Doti,"Development and Project, Expression of Interests, Tender Notice, Bid, Development / NGO"
VT Mobiliser (1 Female only)-Residential,Opportunity Village Nepal,Pokhara,"Development and Project, Business Administration, NGO/INGO/Social work"
Call for Proposal for consultancy service,Association of Community Radio Broadcasters Nepal,Lalitpur,"Development and Project, Expression of Interests, Tender Notice, Bid"
Individual Consultant - Capacity Building Officer,UNDP,Okhaldhunga,"Development and Project, Environment and climate"
Province Director,KIRDARC-Nepal,Birendranagar Surkhet,"Education, Social Science, Development and Project"
Various,Vijay Motors Pvt. Ltd.,Kathmandu,Automotive / Automobiles
Crew Member (All-rounder),JobsNepal.com Direct Recruitment Service,Kathmandu,Hospitality / Hotel
Administrative Officer,JobsNepal.com Direct Recruitment Service,Kathmandu,Administrative / Management
"Re-Call for Proposal for Consultancy for assessing the capacity of PHTC to conduct SRHR training and training need assessment in Madhesh, Lumbini and Sudurpaschim Provinces",ADRA Nepal,"Madhesh Province, Lumbini Province, Sudurpashchim Province","Development and Project, Employment Training"
MEAL Technical Officer,People in  Need,,
MEAL-CFRM Coordinator,People in  Need,Kathmandu,"Development and Project, Development / NGO"
Consultant to develop a Climate Resilient Health Facility Emergency Preparedness and Management Plan,International Federation of Red Cross and Red Crescent Societies (IFRC),Pokhara,"Public Health, Development and Project, Research Officer"
Quality Improvement Manager / Research Officer (Re-Vacancy),International Nepal Fellowship,Lalitpur,"Development and Project, Expression of Interests, Tender Notice, Bid"
कृषि सामग्रीहरू खरिदको लागि सिलबन्दी दरभाउपत्र आह्वानको सूचना,Lele Community Development Center,Kathmandu,"Development and Project, Expression of Interests, Tender Notice, Bid"
Call for Expression of Interest (EOI),United Mission to Nepal,Dadeldhura,"Development and Project, Development / NGO"
Project Coordinator,Astha Nepal,Janakpur,"Development and Project, Finance & Administration"
कर्मचारीको आवश्यक्ता,AANGAN,Lalitpur,Information Technology
Senior Python Engineer,Javra Software Nepal Pvt. Ltd.,"Mahashila 5, Parbat, Gandaki Province","Accounting and Finance, Development and Project, Finance & Administration, Agriculture/Livelihood"
लेखा अधिकृत/कृषि प्राविधिक/प्रशोधन केन्द्र व्यवस्थापक,"ENPRED, Nepal","Rupandehi, Lumbini Province","Development / NGO, Development / INGO, NGO/INGO/Social work"
"Terms of Reference (TOR) for conducting a study to identify green jobs opportunities, major challenges and suggest strategies for nature-based solutions including value chain analysis",Center for Development and Disaster Management (CDM-Nepal),"Gandaki Province, Bagmati Province, Lumbini Province, Koshi Pradesh","Administrative / Management, Tourism Industry, Development and Project"
Short Term Technical Assistance (STTA),Deloitte,Kathmandu,"Development and Project, Expression of Interests, Tender Notice, Bid, Development / NGO"
छात्रवृत्तिका लागि आवेदन सम्बन्धि सूचना !,Nepal National Dalit Social Welfare Organization (NNDSWO),Sindhuli,"Development and Project, Development / NGO"
Programme Manager,Sindhuli Integrated Development Services Nepal (SIDS Nepal),"Madhesh Province, Lumbini Province","Development and Project, Expression of Interests, Tender Notice, Bid"
Re- Request for Application (RFA),The Asia Foundation,Surkhet,"Development and Project, Expression of Interests, Tender Notice, Bid, Development / NGO"
शिलवन्दी कोटेशन आह्वान सम्वन्धि सूचना,Social Awareness Center SAC Nepal,Nuwakot,Hydropower
Sub Overseer (civil/electrical/mechanical),Buddhabhumi Nepal Hydropower Company Ltd.,Kathmandu,Development and Project
Request for Full Application,Deloitte,Kathmandu,Accounting and Finance
Accountant,Buddhabhumi Nepal Hydropower Company Ltd.,Kathmandu,"Technical, Development and Project, Food Technology"
Technical Expert Food Systems and Nutrition,Welthungerhilfe,Chitwan,"Agriculture, Education, Social Science, Development and Project"
कर्मचारी पदपूर्ति सम्बन्धि सूचना,National Federation of the Deaf Nepal (NDFN),"Rukum West, Jajarkot","Engineering - Architecture, Development and Project, Engineering, Engineering - Structural"
Senior Project Associate (Engineering),IOM Nepal,Kathmandu,"Development and Project, Development / NGO"
Project Officer (PO),Rural Women's Development and Unity Centre (RUWDUC),Kathmandu,"Development and Project, Expression of Interests, Tender Notice, Bid, Development / INGO"
Request for Quotation (RFQ) for Duty-Free Scooters (Re-Advertisement),Winrock International (Feed the Future Nepal USAID Agricultural Inputs),"Madhesh Province, Rautahat","Accounting and Finance, Development and Project, Finance & Administration, Development / NGO"
Vacancy Announcement for Various Positions,Campaign Nepal,Lalitpur,"Development and Project, Expression of Interests, Tender Notice, Bid"
Request Proposal for Engineering Consultant for the Construction of Overhead Tank and Water Distribution System as part of “Health Reform Project 2”,ADRA Nepal,,Lalitpur
Consultancy Services on Oxfam Country Strategy (OCS Review),Oxfam in Nepal,"Development and Project, Expression of Interests, Tender Notice, Bid, Development / NGO",Assistant
Request for Proposal and Call for Quotation,Yuwalaya,Lalitpur,"Development and Project, Employment Training, Expression of Interests, Tender Notice, Bid"
Executive Assistant,Well Minded Australia,Kathmandu,"Development and Project, Expression of Interests, Tender Notice, Bid"
Crash Training Course on Humanitarian Response Management (HRM),Nepal Development Initiative Consulting Pvt Ltd,"Mahottari, Bardibas","Development and Project, Expression of Interests, Tender Notice, Bid"
RE-REQUEST FOR PROPOSAL,Save the Children,Lalitpur,Development and Project
किताव छपाइको लागि दरभाउ पत्र (कोटेशन) आह्वान गरिएको सम्बन्धमा ।,Community Development & Advocacy Forum Nepal,"Mahottari, Bardibas","Development and Project, Expression of Interests, Tender Notice, Bid"
Procurement Notice – Individual Consultant – GESI Expert,UNDP,Agriculture + Livestock,"Rupandehi, Lumbini Province"
Request for Proposal: Building Electrician Training,Community Development & Advocacy Forum Nepal,"Engineering - Civil, Development / NGO, Development / INGO, Management Consultant, NGO/INGO/Social work, Environment and climate",Kathmandu
खोर तथा गोठ सुधार सम्बन्धि निर्माण सामग्री खरिद लागी बोलपत्र आह्वानको सुचना,SAHAMATI,"Development and Project, Auditing",Surkhet
Terms of Reference (TOR) to Organize workshops with municipal officials on anticipatory action and SRSP & also to Reinforce the establishment of Local Emergency Operation Centers (LEOCs),Center for Development and Disaster Management (CDM-Nepal),"Development and Project, Expression of Interests, Tender Notice, Bid","Rukum West, Karnali Province, Jajarkot"
Call for Proposal for Gender Equality and Social Inclusion (GESI) Audit,ADRA Nepal,"Engineering - Architecture, Engineering - Civil, Development and Project",Lalitpur
शिलबन्दी कोटेशन आह्वान सम्वन्धि सूचना,Social Awareness Center SAC Nepal,"Media / Journalism, Development and Project",Lalitpur
Senior Project Associate (Engineering),IOM Nepal,"Education, Teachers",Kathmandu
संवाददाता आवश्यकता सम्बन्धी सूचना,Association of Community Radio Broadcasters Nepal,"Development and Project, Expression of Interests, Tender Notice, Bid, Development / NGO",Janakpur
Teachers,Shanti Business Academy Pvt.Ltd,"Social Science, Development and Project",Kathmandu
Request for Proposal (RFP) - Research Institute,National Democratic Institute for International Affairs (NDI),"Development and Project, Expression of Interests, Tender Notice, Bid",Kathmandu
कार्यक्रम संयोजक  (Project Coordinator),Dalit Society Welfare Committee Nepal,"Administrative / Management, Graphic Design, Customer Service","Terai Region, Mahottari"
INVITATION FOR BIDS,Tukee Foundation,"Public Health, Development and Project, Development / NGO",Lalitpur
Various Positions,Taskmills,"Development and Project, Expression of Interests, Tender Notice, Bid, Development / NGO",Lalitpur
Field Officer,Ratauli Yuba Club (RYC),,Kathmandu
Request for Proposal/Quotation,Lumanti Support Group for Shelter,"Human Resources, Finance & Administration, Development / NGO",Lalitpur
Dev Ops Intern,LIS Nepal Pvt. Ltd. (Sister Concern of Yomari Group of Companies),"Development and Project, Expression of Interests, Tender Notice, Bid","Lalitpur, Dhangadhi"
Human Resource and Admin Officer,Lumanti Support Group for Shelter,Development / INGO,Kathmandu
REQUEST FOR EXPRESSION OF INTEREST (EOI) FROM ELIGIBLE SUPPLIERS,CARE Nepal,"Development and Project, Expression of Interests, Tender Notice, Bid, Development / NGO",Kathmandu
Sponsorship Correspondence Assistant /  Senior Grants Acquisition Specialist,World Vision International Nepal,"Information Technology, Research",Kathmandu
Request for Proposal (RFP)-Readvertise,Winrock International (Feed the Future Nepal USAID Agricultural Inputs),"Development and Project, Expression of Interests, Tender Notice, Bid, Development / NGO",Lalitpur
IT/Research Support Officer,Nepal Bankers' Association,"Accounting and Finance, Finance & Administration, Development / NGO, Business Administration","Birgunj, Lahan, Narayanghat"
REQUEST FOR PROPOSAL,USAID Tayar Nepal,"Administrative / Management, Business Development, Marketing Representatives",
Finance Trainee,Shangri La Development Association,Kathmandu,"Development and Project, Development / INGO"
Market Representatives/Business Development Executive,HIMAL HERBACEUTICALS PVT LTD,Kathmandu,"Development and Project, Development / NGO, Engineering"
SJP MEAL Coordinator for Madhesh,People in  Need,Lalitpur,"Development / NGO, Development / INGO"
"Programme Assistant (Migration, Development and Policy)",IOM Nepal,Mahottari,"Accounting and Finance, Development and Project, Finance & Administration, Development / NGO"
Senior Project Officer- Engineer,PRACTICAL ACTION,Lalitpur,"Accounting and Finance, Development and Project"
Call for Expression of Interest (EOI) for Vendor Roster,Heifer International Nepal,Lalitpur,"Development and Project, Expression of Interests, Tender Notice, Bid"
कर्मचारी आवश्यकता,Ratauli Yuba Club (RYC),"Sunkoshi, sindhupalchowk","Development and Project, Expression of Interests, Tender Notice, Bid"
Finance Manager,Danfe Works Enterprises Nepal,Kathmandu,"Development and Project, Expression of Interests, Tender Notice, Bid"
शिलबन्दी दरभाउ पत्र आह्वान सम्बन्धि सूचना,Centre for Integrated Urban Development,Kathmandu,"Development and Project, Development / NGO"
TENDER NOTICE,Tuki Association Sunkoshi,Kathmandu,"Information Technology, Computer - Hardware / Network"
Expression of Interest for Vendor Listing,Ipas Nepal,Kathmandu,"Information Technology, Web Designing & Programming, Engineering - Software, Software Development"
Call for Proposal -Project End Evaluation,﻿﻿﻿﻿﻿﻿CBM Global Nepal Country Office,Kathmandu,"Information Technology, Engineering - Software, Software Development"
Support Engineer (12 month FTC),Verisk Nepal Pvt. Ltd.,Lalitpur,"Development and Project, Expression of Interests, Tender Notice, Bid, Development / NGO"
ETL Developer,Verisk Nepal Pvt. Ltd.,Kathmandu,"Information Technology, Web Development, Software Development"
Senior DevOps Engineer,Verisk Nepal Pvt. Ltd.,Kathmandu,"Information Technology, Engineering - Software, Web Designing and Programming"
Request for Quotation – 4WD Vehicle,Habitat Nepal,Kathmandu,"Information Technology, Web Designing & Programming, Engineering - Software, Software Development"
Python Developer,Verisk Nepal Pvt. Ltd.,Sunsari,"Agriculture, Administrative / Management, Accounting and Finance"
Java Developer,Verisk Nepal Pvt. Ltd.,Kathmandu,"Information Technology, Engineering - Software, Software Development"
QA Automation Engineer,Verisk Nepal Pvt. Ltd.,Kathmandu,"Information Technology, Engineering - Software"
कर्मचारी तथा लेखा अभिलेख सफ्टवयर आवश्यकता सम्बन्धि सूचना,Sagun Agriculture Cooperative Society Ltd.,Kathmandu,Engineering - Software
Software Engineer (NoSQL DBA),Verisk Nepal Pvt. Ltd.,Sarlahi,"Education, Accounting and Finance, Social Science, Development and Project"
Python Data Engineer,Verisk Nepal Pvt. Ltd.,Kathmandu,"Development and Project, Development / NGO"
Dot Net Developer,Verisk Nepal Pvt. Ltd.,Lalitpur,"Development and Project, Expression of Interests, Tender Notice, Bid"
Various Positions,Nepal Integrated Development Society(NIDS),Kathmandu,NGO/INGO/Social work
REQUEST FOR QUOTATION,USAID Tayar Nepal,Kathmandu,"Accounting and Finance, Finance & Administration, Business Administration"
Expression of Interest (EOI) for Support to Schools for Formulation of SIP (School Improvement Plan) Consultancy,dZi Foundation,"Lalitpur, Pokhara","Development and Project, Expression of Interests, Tender Notice, Bid"
Natural Resource Management Officer (NRM Officer),Federation of Community Forestry Users Nepal (FECOFUN),Kapilvastu,"Development and Project, Expression of Interests, Tender Notice, Bid"
Admin and Finance Officer/Project Manager,Kids of kathmandu,"Kathmandu, Bhaktapur, Lalitpur","Administrative / Management, Manufacturing, Sales, Front Office / Secretarial, Customer Service, Marketing, Business Administration"
Request for Sealed Proposal (RfP) Notice,LI-BIRD,Lalitpur,"Agriculture, Public Health, Development and Project, Environment and Natural Resource"
सिलबन्दी बोलपत्र आह्वानको सुचना,Lumbini Integrated Development Organization,Dhanusha,"Development and Project, Expression of Interests, Tender Notice, Bid, Development / NGO"
Sales and Marketing Assistant,Jiri Natural Private Limited,Pokhara,"Development and Project, Development / INGO"
Program Officer,KOICA Nepal,Dhangadhi,"Social Science, Development and Project"
Invitation for Bid,Aasaman Nepal,Kathmandu,"Development and Project, Expression of Interests, Tender Notice, Bid, Development / NGO"
Technical Coordinator,Swisscontact | Swiss Foundation for Technical Cooperation,Kathmandu,Information Technology
PROJECT OFFICER,Karkhana Samuha,Kathmandu,Driver
Request for Proposal-Scoping Study for Local Insurance Products for Water Supply and Sanitation Infrastructure,USAID Karnali Water Activity,Kathmandu,
IT Associate,"SOUTH ASIA WATCH ON TRADE, ECONOMICS AND ENVIRONMENT (SAWTEE)",Kathmandu,"Development and Project, Expression of Interests, Tender Notice, Bid, Development / NGO"
Chauffeur (Driver),US Embassy,Kathmandu,"Development and Project, Development / INGO"
Trades Helper,US Embassy,Kathmandu,"Development and Project, Development / INGO"
REQUEST FOR PROPOSAL,USAID Tayar Nepal,Kathmandu,"Development and Project, Development / NGO"
"Request for Proposal-Assess Red Panda Distribution, Occupancy, and Conservation Threats  in Karnali Landscape",USAID Biodiversity (Jal Jangal),Kathmandu,"Education, Sales"
Project Specialist- Education,VSO Nepal,Kathmandu,"Development and Project, Expression of Interests, Tender Notice, Bid, Development / NGO"
Grants and Procurement Officer,USAID Biodiversity (Jal Jangal),Lalitpur,"Tourism Industry, Travel & Ticketing"
Team Lead,Creanovation Technologies Pvt. Ltd.,Kathmandu,Sales
Consultant,Niti Foundation,"Kathmandu, Other - Specify",Sales
Correspondence Representative and  Assistant Correspondence Representative,JourneyDMC,Kathmandu,"Social Science, Development and Project, Research"
Sales person,Triyuga Sales and Marketing Pvt. Ltd,Kathmandu,"Development and Project, Development / NGO"
Corporate Sales manager,Triyuga Sales and Marketing Pvt. Ltd,"Kalikot, Kailali, Mugu, Dailekh","Development and Project, NGO/INGO/Social work"
"MANAGER, RESEARCH, MONITORING AND EVALUATION (RM&E)",Room to Read Nepal,"Kushma Parbat, Gandaki Province","Development and Project, Development / NGO"
Thematic Lead – Education,United Mission to Nepal,Kathmandu,"Database Programming, Engineering - Software, Computer - Programming, Web Designing and Programming, Software Development, Core PHP Developer"
Intern(s),USAID Karnali Water Activity,Lalitpur,Sales
Assistant Officer- Education and Child Protection,SORDEC-Nepal,"Engineer, Information Technology, Computer - Hardware / Network",Kathmandu
PHP Laravel Developer,Code Fusion Technologies Pvt. Ltd.,"Development and Project, Expression of Interests, Tender Notice, Bid, Development / NGO",Kathmandu
Sales Officer,Sajilo Sewa,"Development and Project, Expression of Interests, Tender Notice, Bid, Development / NGO",Kathmandu
IT Support Engineer,ComplianceQuest Nepal Pvt. Ltd.,"Development and Project, Expression of Interests, Tender Notice, Bid","Lalitpur, Madhesh Province, Koshi Pradesh"
Request for Proposal-Radio Magazine Production and Broadcasting,USAID Karnali Water Activity,"Information Technology, Development and Project, Finance & Administration, Mass Communication/Journalism",Kathmandu
Request for Proposal-Radio PSAs Production and Broadcasting,USAID Karnali Water Activity,"Engineering - Software, Software Development",Kathmandu
"Request for Proposal-Annual Financial Audit, Labor Audit and Annual Corporate Income Tax Filing Services for DAI Global LLC",USAID Biodiversity (Jal Jangal),"Engineering - Software, Software Development",
Various Positions,Reintegration of Returnee Migrant Workers (ReMi) Project/Helvetas Nepal,"Rukum West, Rukum, Karnali Province","Development and Project, Expression of Interests, Tender Notice, Bid"
PRINCIPAL SOFTWARE ENGINEER,GrowByData Services Pvt. Ltd.,Kathmandu,"Development and Project, Expression of Interests, Tender Notice, Bid"
PRINCIPAL DATA ENGINEER,GrowByData Services Pvt. Ltd.,Other - Specify,Human Resources
"Family Planning and Reproductive Health (FP/RH), Task Order 3 (TO3) Logistics Outsourcing Deep Dive, Local Consultant",Chemonics International,Kathmandu,"Computer  - Technology/Management, Information Technology, Engineering - Computer, Software Development"
Expression of Interest (EOI)  Karnali Earthquake Recovery Project Partnership: Disability Inclusive Livelihood,﻿﻿﻿﻿﻿﻿CBM Global Nepal Country Office,"Information Technology, Engineering - Computer, Computer - Programming, Software Development",Kathmandu
Call for Request for Application (RFA) on USAID Karnali Water Challenge under USAID’s Karnali Water Activity Grants Program,USAID Karnali Water Activity,Web Design,Birendranagar Surkhet
Recruiting Specialist,TalentBridge Pro,"Education, Development / NGO",Lalitpur
QC Automation Trainee/Associate,ComplianceQuest Nepal Pvt. Ltd.,,Lalitpur
Software Developer – Configuration,ComplianceQuest Nepal Pvt. Ltd.,Content Writing,Lalitpur
Web Designer (UI/UX),Andmine,"Development and Project, Expression of Interests, Tender Notice, Bid",Kathmandu
Head of Department- English (Re - Advertisement),Kopila Valley School Pvt Ltd,"Administrative / Management, Sales",Kathmandu
SEO Senior specialist,Job Consult Nepal,"Computer - Programming, Web Development",Kathmandu
Content Writer,Job Consult Nepal,"Development and Project, Expression of Interests, Tender Notice, Bid, Development / INGO",Kathmandu
Expression of Interest for Insurance Services (Re- advertised),dZi Foundation,"Development and Project, Expression of Interests, Tender Notice, Bid",Kathmandu
Office Executive,Reputed travel company,Front Desk / Reception,Computer - Hardware / Network
Senior Web Developer,Andmine,Kathmandu,"Technical, Computer - Hardware / Network"
Request for Proposal (RFP),FHI 360 Nepal,Administrative / Management,Kathmandu
Request for Proposal,USAID Karnali Water Activity,"Development and Project, Development / NGO, Think Tank, Research Institution",Kathmandu
Front Desk Receptionist,NCA College of Management,"Development and Project, Expression of Interests, Tender Notice, Bid, Development / INGO",Kathmandu
Sr. System Administrator,LIS Nepal Pvt. Ltd. (Sister Concern of Yomari Group of Companies),"Engineering - Computer, Computer - Programming, Software Development",Kathmandu
